{
  "schemaVersion": "tenkings.ai-grader.replay-manifest.v1",
  "seed": 20260712,
  "corpusKind": "synthetic",
  "missingRealCorpusCategories": [
    "Approved blinded Dell Basler Mono8 front/back corpus",
    "Real black, white, and neutral production plates under accepted Leimac profiles",
    "Real same-tone borders, foil, glare, shadow, and worn-corner prevalence",
    "Human-approved no-card, hand, ruler, and wrong-object negatives",
    "Measured front/back recall gap and zero-false-Ready negative set",
    "Dell CPU-load, BlockID, hardware timestamp, and overlay-age timing"
  ],
  "cases": [
    { "id": "neutral-front", "pairId": "neutral-pair", "side": "Front", "category": "neutral_plate", "expectedCard": true, "polarity": "dark_on_light", "rotationDegrees": 0, "perspective": 0, "translationX": 0, "translationY": 0, "clipping": 0, "borderContrast": 125, "effects": [], "previewEpoch": 1, "sideEpoch": 1 },
    { "id": "neutral-back", "pairId": "neutral-pair", "side": "Back", "category": "neutral_plate", "expectedCard": true, "polarity": "light_on_dark", "rotationDegrees": 2, "perspective": 0.02, "translationX": 0.01, "translationY": 0, "clipping": 0, "borderContrast": 120, "effects": [], "previewEpoch": 1, "sideEpoch": 2 },
    { "id": "black-front", "pairId": "black-pair", "side": "Front", "category": "black_plate", "expectedCard": true, "polarity": "light_on_dark", "rotationDegrees": -8, "perspective": 0, "translationX": -0.03, "translationY": 0.02, "clipping": 0, "borderContrast": 100, "effects": [], "previewEpoch": 2, "sideEpoch": 3 },
    { "id": "black-back", "pairId": "black-pair", "side": "Back", "category": "black_plate", "expectedCard": true, "polarity": "light_on_dark", "rotationDegrees": 9, "perspective": -0.04, "translationX": 0.03, "translationY": -0.01, "clipping": 0, "borderContrast": 100, "effects": [], "previewEpoch": 2, "sideEpoch": 4 },
    { "id": "white-front", "pairId": "white-pair", "side": "Front", "category": "white_plate", "expectedCard": true, "polarity": "dark_on_light", "rotationDegrees": -4, "perspective": 0.03, "translationX": 0, "translationY": 0, "clipping": 0, "borderContrast": 105, "effects": [], "previewEpoch": 3, "sideEpoch": 5 },
    { "id": "white-back", "pairId": "white-pair", "side": "Back", "category": "white_plate", "expectedCard": true, "polarity": "dark_on_light", "rotationDegrees": 5, "perspective": -0.03, "translationX": 0.02, "translationY": 0.02, "clipping": 0, "borderContrast": 105, "effects": [], "previewEpoch": 3, "sideEpoch": 6 },
    { "id": "same-tone-front", "pairId": "same-tone-pair", "side": "Front", "category": "same_tone_border", "expectedCard": true, "polarity": "dark_on_light", "rotationDegrees": 0, "perspective": 0, "translationX": 0, "translationY": 0, "clipping": 0, "borderContrast": 4, "effects": ["no_gradient"], "previewEpoch": 4, "sideEpoch": 7, "expectedReady": false },
    { "id": "same-tone-back", "pairId": "same-tone-pair", "side": "Back", "category": "same_tone_border", "expectedCard": true, "polarity": "light_on_dark", "rotationDegrees": 1, "perspective": 0, "translationX": 0, "translationY": 0, "clipping": 0, "borderContrast": 4, "effects": ["no_gradient"], "previewEpoch": 4, "sideEpoch": 8, "expectedReady": false },
    { "id": "foil-front", "pairId": "foil-pair", "side": "Front", "category": "foil_glare", "expectedCard": true, "polarity": "dark_on_light", "rotationDegrees": 12, "perspective": 0.08, "translationX": 0.02, "translationY": -0.01, "clipping": 0, "borderContrast": 120, "effects": ["foil", "glare"], "previewEpoch": 5, "sideEpoch": 9 },
    { "id": "foil-back", "pairId": "foil-pair", "side": "Back", "category": "foil_shadow", "expectedCard": true, "polarity": "light_on_dark", "rotationDegrees": -12, "perspective": -0.08, "translationX": -0.01, "translationY": 0.01, "clipping": 0, "borderContrast": 120, "effects": ["foil", "shadow"], "previewEpoch": 5, "sideEpoch": 10 },
    { "id": "worn-front", "pairId": "worn-pair", "side": "Front", "category": "worn_corners", "expectedCard": true, "polarity": "dark_on_light", "rotationDegrees": 18, "perspective": 0.06, "translationX": 0, "translationY": 0, "clipping": 0, "borderContrast": 125, "effects": ["worn_corners"], "previewEpoch": 6, "sideEpoch": 11 },
    { "id": "worn-back", "pairId": "worn-pair", "side": "Back", "category": "worn_corners", "expectedCard": true, "polarity": "light_on_dark", "rotationDegrees": -18, "perspective": -0.06, "translationX": 0, "translationY": 0, "clipping": 0, "borderContrast": 125, "effects": ["worn_corners"], "previewEpoch": 6, "sideEpoch": 12 },
    { "id": "rotation-minus35", "pairId": "rotation-pair", "side": "Front", "category": "rotation_envelope", "expectedCard": true, "polarity": "dark_on_light", "rotationDegrees": -35, "perspective": 0, "translationX": 0, "translationY": 0, "clipping": 0, "borderContrast": 130, "effects": [], "previewEpoch": 7, "sideEpoch": 13 },
    { "id": "rotation-plus35", "pairId": "rotation-pair", "side": "Back", "category": "rotation_envelope", "expectedCard": true, "polarity": "light_on_dark", "rotationDegrees": 35, "perspective": 0, "translationX": 0, "translationY": 0, "clipping": 0, "borderContrast": 130, "effects": [], "previewEpoch": 7, "sideEpoch": 14 },
    { "id": "perspective-front", "pairId": "perspective-pair", "side": "Front", "category": "perspective_translation", "expectedCard": true, "polarity": "dark_on_light", "rotationDegrees": 8, "perspective": 0.18, "translationX": -0.08, "translationY": 0.05, "clipping": 0, "borderContrast": 130, "effects": [], "previewEpoch": 8, "sideEpoch": 15 },
    { "id": "perspective-back", "pairId": "perspective-pair", "side": "Back", "category": "perspective_translation", "expectedCard": true, "polarity": "light_on_dark", "rotationDegrees": -8, "perspective": -0.18, "translationX": 0.08, "translationY": -0.05, "clipping": 0, "borderContrast": 130, "effects": [], "previewEpoch": 8, "sideEpoch": 16 },
    { "id": "clipped-front", "pairId": "clipped-pair", "side": "Front", "category": "clipped", "expectedCard": true, "polarity": "dark_on_light", "rotationDegrees": 0, "perspective": 0, "translationX": 0, "translationY": 0, "clipping": 0.12, "borderContrast": 130, "effects": [], "previewEpoch": 9, "sideEpoch": 17 },
    { "id": "clipped-back", "pairId": "clipped-pair", "side": "Back", "category": "clipped", "expectedCard": true, "polarity": "light_on_dark", "rotationDegrees": 6, "perspective": 0, "translationX": 0, "translationY": 0, "clipping": 0.10, "borderContrast": 130, "effects": [], "previewEpoch": 9, "sideEpoch": 18 },
    { "id": "no-card", "pairId": "negative-pair-a", "side": "Front", "category": "no_card", "expectedCard": false, "polarity": "neutral", "rotationDegrees": 0, "perspective": 0, "translationX": 0, "translationY": 0, "clipping": 0, "borderContrast": 0, "effects": ["no_card"], "previewEpoch": 10, "sideEpoch": 19 },
    { "id": "hands", "pairId": "negative-pair-a", "side": "Back", "category": "hands", "expectedCard": false, "polarity": "neutral", "rotationDegrees": 0, "perspective": 0, "translationX": 0, "translationY": 0, "clipping": 0, "borderContrast": 0, "effects": ["hands"], "previewEpoch": 10, "sideEpoch": 20 },
    { "id": "ruler", "pairId": "negative-pair-b", "side": "Front", "category": "ruler", "expectedCard": false, "polarity": "neutral", "rotationDegrees": 0, "perspective": 0, "translationX": 0, "translationY": 0, "clipping": 0, "borderContrast": 0, "effects": ["ruler"], "previewEpoch": 11, "sideEpoch": 21 },
    { "id": "wrong-object", "pairId": "negative-pair-b", "side": "Back", "category": "wrong_object", "expectedCard": false, "polarity": "neutral", "rotationDegrees": 0, "perspective": 0, "translationX": 0, "translationY": 0, "clipping": 0, "borderContrast": 0, "effects": ["wrong_object"], "previewEpoch": 11, "sideEpoch": 22 },
    { "id": "frozen-source", "pairId": "frozen-pair", "side": "Front", "category": "fresh_before_frozen", "expectedCard": true, "polarity": "dark_on_light", "rotationDegrees": 4, "perspective": 0, "translationX": 0, "translationY": 0, "clipping": 0, "borderContrast": 130, "effects": [], "previewEpoch": 12, "sideEpoch": 23 },
    { "id": "frozen-repeat", "pairId": "frozen-pair", "side": "Front", "category": "frozen_frame", "expectedCard": true, "polarity": "dark_on_light", "rotationDegrees": 4, "perspective": 0, "translationX": 0, "translationY": 0, "clipping": 0, "borderContrast": 130, "effects": [], "previewEpoch": 12, "sideEpoch": 23, "frozenOf": "frozen-source", "sequenceKind": "frozen", "expectedReady": false },
    { "id": "slow-drift", "pairId": "motion-pair", "side": "Front", "category": "slow_drift", "expectedCard": true, "polarity": "dark_on_light", "rotationDegrees": 6, "perspective": 0.03, "translationX": -0.02, "translationY": 0, "clipping": 0, "borderContrast": 130, "effects": [], "previewEpoch": 13, "sideEpoch": 24, "sequenceKind": "slow_drift", "frameCount": 6, "motionStepX": 0.003, "motionStepY": 0.002, "expectedReady": true },
    { "id": "sudden-motion", "pairId": "motion-pair", "side": "Back", "category": "sudden_motion", "expectedCard": true, "polarity": "light_on_dark", "rotationDegrees": -6, "perspective": -0.03, "translationX": -0.04, "translationY": 0, "clipping": 0, "borderContrast": 130, "effects": [], "previewEpoch": 13, "sideEpoch": 25, "sequenceKind": "sudden_motion", "frameCount": 7, "motionStepX": 0.16, "expectedReady": true },
    { "id": "epoch-transition", "pairId": "epoch-pair", "side": "Front", "category": "epoch_transition", "expectedCard": true, "polarity": "dark_on_light", "rotationDegrees": 3, "perspective": 0, "translationX": 0, "translationY": 0, "clipping": 0, "borderContrast": 130, "effects": [], "previewEpoch": 14, "sideEpoch": 26, "sequenceKind": "epoch_transition", "frameCount": 7, "expectedReady": true },